{
  "schemaVersion": 1,
  "graphId": "graph-fixture-0001",
  "project": {
    "projectId": "fixture-project"
  },
  "baseCommit": "0123456abcdef",
  "approvalStatus": "unapproved",
  "provenance": {
    "createdBy": "operator:test",
    "createdByType": "operator",
    "createdAt": "2026-07-14T00:00:00.000Z",
    "source": "operator cli"
  },
  "status": "draft",
  "nodes": [
    {
      "nodeId": "node-1",
      "taskType": "fixture-mutation",
      "objective": "Create a fixture file inside an explicitly allowed scope.",
      "acceptanceCriteria": [
        "hello.txt exists with exact content"
      ],
      "allowedPaths": [
        ".gorp/fixtures/slice/**"
      ],
      "forbiddenPaths": [
        "src/**",
        ".git/**"
      ],
      "requiredCommands": [
        {
          "executable": "npx",
          "args": [
            "vitest",
            "run"
          ],
          "timeoutMs": 600000
        }
      ],
      "expectedArtifacts": [
        ".gorp/fixtures/slice/hello.txt"
      ],
      "workerAdapter": "fixture",
      "dependencies": [],
      "state": "pending",
      "attempt": 0
    }
  ],
  "transitions": []
}
